Name;Sex;Event;Equipment;Age;AgeClass;BirthYearClass;Division;BodyweightKg;WeightClassKg;Squat1Kg;Squat2Kg;Squat3Kg;Squat4Kg;Best3SquatKg;Bench1Kg;Bench2Kg;Bench3Kg;Bench4Kg;Best3BenchKg;Deadlift1Kg;Deadlift2Kg;Deadlift3Kg;Deadlift4Kg;Best3DeadliftKg;TotalKg;Place;Dots;Wilks;Glossbrenner;Goodlift;Tested;Country;State;Federation;ParentFederation;Date;MeetCountry;MeetState;MeetTown;MeetName
Adéla Nejedlá;F;SBD;Raw;20.5;20-23;19-23;Open;64.3;;110;117.5;122.5;;122.5;52.5;57.5;60;;60;140;147.5;152.5;;152.5;335;9;355.88;354.29;312.76;72.35;Yes;USA;;CSST;IPF;2020-02-15;Czechia;;Sedlčany;MMistrovství západních Čech družstev v klasickém silovém trojboji
Adéla Nejedlá;F;SBD;Raw;20;20-23;19-23;Juniors;62.9;63;105;112.5;117.5;;117.5;52.5;57.5;-60;;57.5;135;140;145;;145;320;3;344.50;344.08;303.83;70.08;Yes;USA;;CSST;IPF;2019-12-14;Czechia;;Zastávka;Pohár starosty města Zbýšov juniorů v klasickém silovém trojboji
Adéla Nejedlá;F;B;Raw;20;20-23;19-23;Open;62.7;63;;;;;;52.5;57.5;-60;;57.5;;;;;;57.5;3;62.02;61.98;54.73;48.11;Yes;USA;;CSST;IPF;2019-11-30;Czechia;;Jindřichův Hradec;Otevřené mistrovství České republiky mužů a žen v klasickém benčpresu
Adéla Nejedlá;F;SBD;Raw;20;20-23;19-23;Open;68.75;75;;;;;105;;;;;57.5;;;;;130;292.5;3;298.82;294.67;259.85;60.72;Yes;USA;VA;USPA;IPL;2019-04-27;USA;VA;Vienna;Drug Tested M.A.S.S. Weekend Classic
Adéla Nejedlá;F;SBD;Raw;20;20-23;19-23;Juniors 20-23;68.75;75;;;;;105;;;;;57.5;;;;;130;292.5;2;298.82;294.67;259.85;60.72;Yes;USA;VA;USPA;IPL;2019-04-27;USA;VA;Vienna;Drug Tested M.A.S.S. Weekend Classic
