Name;Sex;Event;Equipment;Age;AgeClass;BirthYearClass;Division;BodyweightKg;WeightClassKg;Squat1Kg;Squat2Kg;Squat3Kg;Squat4Kg;Best3SquatKg;Bench1Kg;Bench2Kg;Bench3Kg;Bench4Kg;Best3BenchKg;Deadlift1Kg;Deadlift2Kg;Deadlift3Kg;Deadlift4Kg;Best3DeadliftKg;TotalKg;Place;Dots;Wilks;Glossbrenner;Goodlift;Tested;Country;State;Federation;ParentFederation;Date;MeetCountry;MeetState;MeetTown;MeetName
Alejandro Álvarez Delgado;M;SBD;Raw;41.5;40-44;40-49;M1;73.09;74;160;-170;-170;;160;120;-125;-125;;120;215;227.5;238;;238;518;2;377.90;375.92;363.63;76.54;Yes;;;AEP;IPF;2019-07-12;Spain;;León;Campeonato de España de Masters de Powerlifting & Open de Powerlifting
Alejandro Álvarez Delgado;M;SBD;Raw;41.5;40-44;40-49;M1;72.9;74;145;155;160;;160;115;125;-130;;125;210;225;237.5;;237.5;522.5;2;381.84;379.90;367.52;77.31;Yes;;;AEP;IPF;2019-02-09;Spain;;Madrid;IV Campeonato de Madrid Powerlifting y Press Banca
Alejandro Álvarez Delgado;M;D;Raw;40.5;40-44;40-49;SNR;73.28;74;;;;;;;;;;;210;225;236;;236;236;2;171.88;170.95;165.34;;Yes;;;AEP;IPF;2018-11-17;Spain;;Albacete;Campeonato de España Absoluto de Press Banca y de Peso Muerto
Alejandro Álvarez Delgado;M;SBD;Raw;40.5;40-44;40-49;SNR;73.35;74;140;150;155;;155;115;122.5;125;;125;220;232.5;-240;;232.5;512.5;7;373.01;370.98;358.79;75.59;Yes;;;AEP;IPF;2018-06-30;Spain;;Alhaurín de la Torre;Copa de España de Powerlifting
Alejandro Álvarez Delgado;M;SBD;Raw;40.5;40-44;40-49;M1;72.25;74;130;140;145;;145;110;117.5;122.5;;122.5;210;225;232.5;;232.5;500;4;367.58;365.92;354.13;74.32;Yes;;;AEP;IPF;2018-01-27;Spain;;Rivas-Vaciamadrid;Campeonato de la Comunidad de Madrid
Alejandro Álvarez Delgado;M;SBD;Raw;39.5;35-39;40-49;M1;71.85;74;135;145;150;;150;110;117.5;120;;120;220;222.5;230;;230;500;11;368.95;367.42;355.67;74.54;Yes;;;AEP;IPF;2017-11-25;Spain;;Talavera de la Reina;Copa de España de Powerlifting y Press Banca
Alejandro Álvarez Delgado;M;D;Raw;39.5;35-39;40-49;M1;72.8;74;;;;;;;;;;;200;215;222.5;;222.5;222.5;5;162.75;161.94;156.67;;Yes;;;AEP;IPF;2017-06-25;Spain;;Madrid;XVI Campeonato de España de Peso Muerto
Alejandro Álvarez Delgado;M;SBD;Raw;39.5;35-39;40-49;M1;71.35;74;130;140;-142.5;;140;102.5;110;-112.5;;110;190;205;212.5;;212.5;462.5;17;342.89;341.63;330.80;69.20;Yes;;;AEP;IPF;2017-02-11;Spain;;Madrid;Campeonato de la Comunidad de Madrid
