Name;Sex;Event;Equipment;Age;AgeClass;BirthYearClass;Division;BodyweightKg;WeightClassKg;Squat1Kg;Squat2Kg;Squat3Kg;Squat4Kg;Best3SquatKg;Bench1Kg;Bench2Kg;Bench3Kg;Bench4Kg;Best3BenchKg;Deadlift1Kg;Deadlift2Kg;Deadlift3Kg;Deadlift4Kg;Best3DeadliftKg;TotalKg;Place;Dots;Wilks;Glossbrenner;Goodlift;Tested;Country;State;Federation;ParentFederation;Date;MeetCountry;MeetState;MeetTown;MeetName
Aleksey Verkholamov;M;SBD;Raw;15.5;16-17;14-18;Juniors;50.7;53;;;;;87.5;;;;;57.5;;;;;110;255;1;250.24;257.03;253.49;45.78;Yes;;;FPR;IPF;2020-02-02;Russia;KLU;Sukhinichi;Kaluga Classic Powerlifting Championships
Aleksey Verkholamov;M;B;Raw;15.5;16-17;14-18;Sub-Juniors;50.32;53;;;;;;47.5;52.5;57.5;;57.5;;;;;;57.5;1;56.84;58.43;57.65;37.95;Yes;;;FPR;IPF;2020-01-17;Russia;KLU;Maloyaroslavets;Kaluga Sports Schools Bench Press Championships
Aleksey Verkholamov;M;SBD;Raw;14.5;13-15;14-18;Sub-Juniors;49.3;53;;;;;87.5;;;;;57.5;;;;;117.5;262.5;1;264.81;272.74;269.40;47.84;Yes;;;FPR;IPF;2019-03-29;Russia;KLU;Sukhinichi;Kaluga Oblast Sub-Juniors Classic Powerlifting Championships
Aleksey Verkholamov;M;B;Single-ply;13.5;13-15;14-18;Sub-Juniors;48;53;;;;;;45;47.5;-50;;47.5;;;;;;47.5;1;49.23;50.84;50.28;31.85;Yes;;;FPR;IPF;2018-12-22;Russia;KLU;Kozelsk;Kaluga Oblast Bench Press Championships
Aleksey Verkholamov;M;SBD;Raw;13.5;13-15;14-18;Sub-Juniors;48;53;;;;;70;;;;;47.5;;;;;90;207.5;1;215.06;222.09;219.66;38.37;Yes;;;FPR;IPF;2018-12-22;Russia;KLU;Kozelsk;Kaluga Oblast Sub-Juniors Powerlifting Championships
