Name;Sex;Event;Equipment;Age;AgeClass;BirthYearClass;Division;BodyweightKg;WeightClassKg;Squat1Kg;Squat2Kg;Squat3Kg;Squat4Kg;Best3SquatKg;Bench1Kg;Bench2Kg;Bench3Kg;Bench4Kg;Best3BenchKg;Deadlift1Kg;Deadlift2Kg;Deadlift3Kg;Deadlift4Kg;Best3DeadliftKg;TotalKg;Place;Dots;Wilks;Glossbrenner;Goodlift;Tested;Country;State;Federation;ParentFederation;Date;MeetCountry;MeetState;MeetTown;MeetName
Aleksandr Skrypnik;M;SBD;Raw;21.5;20-23;19-23;Juniors;125.95;120+;;;;;280;;;;;190;;;;;315;785;1;443.85;446.65;427.11;89.37;Yes;;;FPR;IPF;2014-12-22;Russia;VLA;Suzdal;Russian Juniors & Sub-Juniors Classic Powerlifting Championships
Aleksandr Skrypnik;M;B;Raw;21.5;20-23;19-23;Open;124.75;120+;;;;;;160;180;195;;195;;;;;;195;1;110.59;111.17;106.40;80.93;Yes;;;FPR;IPF;2014-05-09;Russia;NIZ;Nizhny Novgorod;Russian Universities Classic Bench Press Championships
Aleksandr Skrypnik;M;SBD;Raw;21.5;20-23;19-23;Juniors;124.4;120+;;;;;290;;;;;190;;;;;300;780;2;442.74;444.92;425.94;89.27;Yes;;;FPR;IPF;2014-03-26;Russia;TUL;Tula;Russian Classic Powerlifting Championships
Aleksandr Skrypnik;M;SBD;Single-ply;19.5;20-23;19-23;Open;122;120+;;;;;320;;;;;200;;;;;;;DQ;;;;;Yes;;;FPR;IPF;2012-11-28;Russia;MOW;Moscow;Central Federal District and Moscow City Powerlifing Championships
Aleksandr Skrypnik;M;SBD;Raw;19.5;20-23;19-23;Open;116.85;120;;;;;250;;;;;170;;;;;280;700;1;405.66;405.05;387.93;82.33;Yes;;;FPR;IPF;2012-10-14;Russia;CHE;Magnitogorsk;Russian Universities Classic Powerlifting Championships
Aleksandr Skrypnik;M;B;Raw;18.5;18-19;19-23;Open;99.2;105;;;;;;120;140;-150;;140;;;;;;140;3;86.47;85.48;81.65;64.38;Yes;;;FPR;IPF;2011-04-27;Russia;VLA;Vladimir;Russian Universities Bench Press Championships
