Name;Sex;Event;Equipment;Age;AgeClass;BirthYearClass;Division;BodyweightKg;WeightClassKg;Squat1Kg;Squat2Kg;Squat3Kg;Squat4Kg;Best3SquatKg;Bench1Kg;Bench2Kg;Bench3Kg;Bench4Kg;Best3BenchKg;Deadlift1Kg;Deadlift2Kg;Deadlift3Kg;Deadlift4Kg;Best3DeadliftKg;TotalKg;Place;Dots;Wilks;Glossbrenner;Goodlift;Tested;Country;State;Federation;ParentFederation;Date;MeetCountry;MeetState;MeetTown;MeetName
Aleksandr Ulyanenko;M;SBD;Raw;17.5;18-19;14-18;Sub-Juniors;58.2;59;;;;;80;;;;;72.5;;;;;150;302.5;4;261.89;265.38;259.60;50.42;Yes;;;FPR;IPF;2014-02-22;Russia;IRK;Zalari;Irkutsk Oblast Sub-Juniors Powerlifting Tournament
Aleksandr Ulyanenko;M;SBD;Raw;16.5;16-17;14-18;Sub-Juniors;55;59;;;;;77.5;;;;;60;;;;;120;257.5;7;234.20;238.62;234.20;44.25;Yes;;;FPR;IPF;2013-02-24;Russia;IRK;Zalari;Irkutsk Oblast Defener of the Fatherland Sub-Juniors Powerlifting Tournament
Aleksandr Ulyanenko;M;SBD;Raw;15.5;16-17;14-18;Sub-Juniors;52.25;53;;;;;75;;;;;57.5;;;;;110;242.5;7;231.21;236.77;233.11;42.83;Yes;;;FPR;IPF;2012-12-15;Russia;IRK;Tulun;Irkutsk Oblast Sub-Juniors Classic Powerlifting Championships
Aleksandr Ulyanenko;M;SBD;Single-ply;15.5;16-17;14-18;Sub-Juniors;47.4;48;;;;;75;;;;;45;;;;;110;230;3;241.49;249.70;247.10;40.25;Yes;;;FPR;IPF;2012-04-14;Russia;IRK;Bratsk;Irkuts Oblast Sub-Juniors Powerlifting Championships
Aleksandr Ulyanenko;M;SBD;Single-ply;14.5;13-15;14-18;Sub-Juniors;45.3;48;;;;;65;;;;;42.5;;;;;100;207.5;4;228.58;237.40;235.33;37.86;Yes;;;FPR;IPF;2011-12-17;Russia;IRK;Tulun;Irkutsk Oblast Sub-Juniors Powerlifting Championships
