Name;Sex;Event;Equipment;Age;AgeClass;BirthYearClass;Division;BodyweightKg;WeightClassKg;Squat1Kg;Squat2Kg;Squat3Kg;Squat4Kg;Best3SquatKg;Bench1Kg;Bench2Kg;Bench3Kg;Bench4Kg;Best3BenchKg;Deadlift1Kg;Deadlift2Kg;Deadlift3Kg;Deadlift4Kg;Best3DeadliftKg;TotalKg;Place;Dots;Wilks;Glossbrenner;Goodlift;Tested;Country;State;Federation;ParentFederation;Date;MeetCountry;MeetState;MeetTown;MeetName
Aleksandr Kholupenko;M;SBD;Raw;28.5;24-34;24-39;Open;92.2;93;;;;;180;;;;;145;;;;;215;540;15;345.01;340.63;326.13;70.94;Yes;;;FPR;IPF;2019-11-01;Russia;KLU;Kaluga;Kaluga Oblast Classic Powerlifting Championships
Aleksandr Kholupenko;M;SBD;Single-ply;25.5;24-34;24-39;Open;91.85;93;;;;;220;;;;;;;;;;;;DQ;;;;;Yes;;;FPR;IPF;2016-12-24;Russia;KLU;Kaluga;Kaluga Oblast Powerlifting Championships
Aleksandr Kholupenko;M;SBD;Raw;24.5;24-34;24-39;Open;86;93;;;;;170;;;;;130;;;;;200;500;12;331.03;327.01;314.05;67.99;Yes;;;FPR;IPF;2015-10-16;Russia;KLU;Kaluga;Kaluga Oblast Classic Powerlifting Summer Spartakiad
Aleksandr Kholupenko;M;SBD;Single-ply;23.5;24-34;24-39;Open;88.7;93;;;;;200;;;;;157.5;;;;;210;567.5;7;369.67;365.02;350.06;63.12;Yes;;;FPR;IPF;2014-10-17;Russia;KLU;Kaluga;Kaluga Oblast Powerlifting Championships
Aleksandr Kholupenko;M;SBD;Single-ply;21.5;20-23;19-23;Open;89.8;93;-200;200;-210;;200;140;150;-155;;150;200;-220;220;;220;570;10;368.98;364.30;349.18;62.97;Yes;;;FPR;IPF;2012-05-04;Russia;KLU;Kaluga;Kaluga Oblast Powerlifting Cup
