Name;Sex;Event;Equipment;Age;AgeClass;BirthYearClass;Division;BodyweightKg;WeightClassKg;Squat1Kg;Squat2Kg;Squat3Kg;Squat4Kg;Best3SquatKg;Bench1Kg;Bench2Kg;Bench3Kg;Bench4Kg;Best3BenchKg;Deadlift1Kg;Deadlift2Kg;Deadlift3Kg;Deadlift4Kg;Best3DeadliftKg;TotalKg;Place;Dots;Wilks;Glossbrenner;Goodlift;Tested;Country;State;Federation;ParentFederation;Date;MeetCountry;MeetState;MeetTown;MeetName
Alessandro Camparsi;M;B;Raw;33.5;24-34;24-39;Senior;102.59;105;;;;;;147.5;-152.5;-152.5;;147.5;;;;;;147.5;12;89.81;88.88;84.87;66.76;Yes;;;FIPL;IPF;2022-06-24;Italy;;S.Zenone al Lambro;8 Gara Nazionale Coppa Bertoletti di Panca Classic
Alessandro Camparsi;M;B;Raw;33.5;24-34;24-39;Senior;105;105;;;;;;147.5;-152.5;-152.5;;147.5;;;;;;147.5;14;88.96;88.14;84.16;66.05;Yes;;;FIPL;IPF;2022-01-22;Italy;;S.Zenone al Lambro;6 Gara Nazionale Open di panca classic maschile e femminile
Alessandro Camparsi;M;B;Raw;32.5;24-34;24-39;Senior;104.4;105;;;;;;145;150;-155;;150;;;;;;150;16;90.67;89.81;85.76;67.34;Yes;;;FIPL;IPF;2021-10-09;Italy;;S.Zenone al Lambro;7 Gara Nazionale di panca classica Coppa Bertoletti
Alessandro Camparsi;M;B;Raw;31.5;24-34;24-39;Senior;104.98;105;;;;;;140;145;147.5;;147.5;;;;;;147.5;3;88.96;88.15;84.17;66.05;Yes;;;FIPL;IPF;2020-08-07;Italy;;;17° Coppa Bertoletti di Panca Classic
Alessandro Camparsi;M;D;Raw;31.5;24-34;24-39;Open;103.83;105;;;;;;;;;;;230;-250;-250;;230;230;19;139.35;137.99;131.76;;Yes;;;FIPL;IPF;2020-02-14;Italy;;San Zenone al Lambro;20° Campionato Italiano di Stacco Gear e 1° Campionato Italiano Senior di Stacco Classic
Alessandro Camparsi;M;D;Raw;30.5;24-34;24-39;Open;103.72;105;;;;;;;;;;;240;245;;;245;245;19;148.50;147.04;140.40;;Yes;;;FIPL;IPF;2019-02-21;Italy;;San Zenone al Lambro;XIX Campionato Italiano Open di Stacco e V Campionato Italiano Open Classic di Stacco
Alessandro Camparsi;M;B;Raw;29.5;24-34;24-39;Open;104.42;105;;;;;;135;140;145;;145;;;;;;145;4;87.65;86.82;82.90;65.09;Yes;;;FIPL;IPF;2018-07-21;Italy;;San Zenone al Lambro;XV Trofeo Nazionale di Panca Bertoletti Classic e Equipped
Alessandro Camparsi;M;D;Raw;29.5;24-34;24-39;Open;104.76;105;;;;;;;;;;;222.5;235;-242.5;;235;235;15;141.86;140.54;134.20;;Yes;;;FIPL;IPF;2018-02-23;Italy;;Vaiano;18° Campionato Italiano di Stacco e 4° Campionato Classic Raw di Stacco
Alessandro Camparsi;M;B;Raw;28.5;24-34;24-39;Open;104.79;105;;;;;;147.5;-150;-150;;147.5;;;;;;147.5;9;89.03;88.20;84.22;66.11;Yes;;;FIPL;IPF;2017-12-15;Italy;;Cecina;XVIII Campionato Italiano di Panca e III Campionato Classic di Panca
Alessandro Camparsi;M;B;Single-ply;28.5;24-34;24-39;Open;104.16;105;;;;;;180;-185;-185;;180;;;;;;180;4;108.91;107.87;103.00;56.10;Yes;;;FIPL;IPF;2017-07-28;Italy;;San Zenone al Lambro;XIV Trofeo Bertoletti
Alessandro Camparsi;M;SBD;Raw;28.5;24-34;24-39;Open;103.63;105;220;227.5;232.5;;232.5;142.5;-145;145;;145;215;222.5;230;;230;607.5;8;368.34;364.72;348.25;75.47;Yes;;;FIPL;IPF;2017-06-09;Italy;;Taneto di Gattatico;III Campionato Classic di Powerlifting
Alessandro Camparsi;M;B;Raw;27.5;24-34;24-39;Open;103.04;105;;;;;;140;145;-150;;145;;;;;;145;10;88.12;87.24;83.30;65.50;Yes;;;FIPL;IPF;2016-12-16;Italy;;Cecina;XVII Campionato Italiano di Panca e II Campionato Classic di Panca Raw
Alessandro Camparsi;M;SBD;Raw;27.5;24-34;24-39;Open;103.83;105;210;220;-225;;220;-135;137.5;-140;;137.5;200;210;217.5;;217.5;575;12;348.36;344.97;329.39;71.36;Yes;;;FIPL;IPF;2016-06-14;Italy;;Taneto di Gattatico;XIII Coppa Bertoletti di Panca e II Campionato Classic di Powerlifting Raw
Alessandro Camparsi;M;B;Single-ply;26.5;24-34;24-39;Open;104.5;105;;;;;;-192.5;-192.5;-195;;;;;;;;;DQ;;;;;Yes;;;FIPL;IPF;2015-12-12;Italy;;Cecina;16° Campionato Italiano di Panca e 1° Campionato Classic di Panca Raw
Alessandro Camparsi;M;SBD;Single-ply;26.5;24-34;24-39;Open;101.66;105;255;-262.5;-265;;255;-185;-185;-185;;;;;;;;;DQ;;;;;Yes;;;FIPL;IPF;2015-10-15;Italy;;Terni;15° Coppa Italia di Powerlifting
Alessandro Camparsi;M;B;Single-ply;26.5;24-34;24-39;Open;103.22;105;;;;;;175;182.5;187.5;;187.5;;;;;;187.5;4;113.87;112.73;107.64;58.69;Yes;;;FIPL;IPF;2015-06-19;Italy;;Taneto di Gattatico;12° Coppa Bertoletti di Panca e 5° Trofeo di Powerlifting Raw
Alessandro Camparsi;M;SBD;Single-ply;26.5;24-34;24-39;Open;102.39;105;230;240;-250;;240;162.5;167.5;172.5;;172.5;190;202.5;212.5;;212.5;625;16;380.85;376.90;359.89;64.63;Yes;;;FIPL;IPF;2015-04-16;Italy;;Marotto Mandolfo;33° Campionato Italiano Assoluto di Powerlifting
Alessandro Camparsi;M;B;Single-ply;25.5;24-34;24-39;Open;93.56;105;;;;;;-160;-160;-160;;;;;;;;;DQ;;;;;Yes;;;FIPL;IPF;2014-12-13;Italy;;Borgaro;Campionato di Panca e Trofeo Nazionale di Panca Raw
Alessandro Camparsi;M;SBD;Raw;25.5;24-34;24-39;Open;95.3;105;170;175;180;;180;120;125;-127.5;;125;190;202.5;-207.5;;202.5;507.5;5;319.19;315.23;301.44;65.61;Yes;;;FIPL;IPF;2014-06-12;Italy;;Genova;Trofeo Bertoletti di Powerlifting Raw e di Panca Geared
Alessandro Camparsi;M;SBD;Single-ply;25.5;24-34;24-39;Open;97.64;105;210;220;230;;230;145;155;160;;160;200;210;-220;;210;600;9;373.22;368.76;352.38;63.48;Yes;;;FIPL;IPF;2014-05-24;Italy;;Marotto Mandolfo;Campionato Italiano Assoluto di Powerlifting
Alessandro Camparsi;M;B;Raw;24.5;24-34;24-39;Open;93;93;;;;;;115;120;-125;;120;;;;;;120;7;76.35;75.38;72.15;56.93;Yes;;;FIPL;IPF;2013-12-14;Italy;;S. Zenone;Campionato di Panca e Trofeo Nazionale di Panca Raw
Alessandro Camparsi;M;SBD;Single-ply;24.5;24-34;24-39;Open;90.3;93;185;195;202.5;;202.5;-120;-120;120;;120;185;200;-220;;200;522.5;15;337.28;333.00;319.10;57.55;Yes;;;FIPL;IPF;2013-10-18;Italy;;Terni;Coppa Italia a Squadre
Alessandro Camparsi;M;SBD;Raw;24.5;24-34;24-39;Open;89;93;145;160;165;;165;112.5;-125;-125;;112.5;165;185;200;;200;477.5;11;310.51;306.59;293.98;63.83;Yes;;;FIPL;IPF;2013-06-14;Italy;;Senigallia;Trofeo Bertoletti di Powerlifting Raw e di Panca Geared
