Name;Sex;Event;Equipment;Age;AgeClass;BirthYearClass;Division;BodyweightKg;WeightClassKg;Squat1Kg;Squat2Kg;Squat3Kg;Squat4Kg;Best3SquatKg;Bench1Kg;Bench2Kg;Bench3Kg;Bench4Kg;Best3BenchKg;Deadlift1Kg;Deadlift2Kg;Deadlift3Kg;Deadlift4Kg;Best3DeadliftKg;TotalKg;Place;Dots;Wilks;Glossbrenner;Goodlift;Tested;Country;State;Federation;ParentFederation;Date;MeetCountry;MeetState;MeetTown;MeetName
Aleš Petr;M;SBD;Raw;19.5;20-23;19-23;Open;89.2;;190;197.5;-202.5;;197.5;120;-130;-130;;120;240;252.5;257.5;;257.5;575;1;373.48;368.76;353.56;76.78;Yes;;;CSST;IPF;2020-02-15;Czechia;;Zastávka;Mistrovství jižní a severní Moravy družstev v klasickém silovém trojboji
Aleš Petr;M;SBD;Single-ply;19.5;20-23;19-23;Juniors;89.16;93;215;222.5;227.5;;227.5;-140;140;-147.5;;140;250;262.5;-270;;262.5;630;2;409.30;404.13;387.48;69.87;Yes;;;CSST;IPF;2020-01-25;Czechia;;Krnov;Otevřené mistrovství České republiky dorostu juniorů a masters v silovém trojboji
Aleš Petr;M;SBD;Raw;18.5;18-19;19-23;Juniors;88.1;93;190;197.5;200;;200;125;-130;-130;;125;240;252.5;-260;;252.5;577.5;1;377.51;372.78;357.61;77.59;Yes;;;CSST;IPF;2019-09-14;Czechia;;Krnov;Mistrovství Moravy juniorů a dorostu v klasickém silovém trojboji
Aleš Petr;M;SBD;Raw;18.5;18-19;19-23;Juniors;81.9;83;175;190;-200;;190;115;120;-125;;120;240;250;-260;;250;560;4;380.92;376.80;362.68;78.04;Yes;;;CSST;IPF;2019-06-30;Czechia;;Frýdlant v Čechách;Pohár Vision Nutrition juniorů v klasickém silovém trojboji
Aleš Petr;M;SBD;Single-ply;18.5;18-19;19-23;Open;87.05;;-200;200;215;;215;132.5;140;-142.5;;140;245;255;-265;;255;610;3;401.26;396.31;380.39;68.55;Yes;;;CSST;IPF;2019-06-22;Czechia;;Lukov;Mistrovství České republiky družstev v silovém trojboji
Aleš Petr;M;SBD;Raw;17.5;18-19;14-18;Sub-Juniors;89.9;93;190;197.5;202.5;;202.5;120;127.5;-132.5;;127.5;240;-260;-260;;240;570;2;368.77;364.09;348.96;75.82;Yes;;;CSST;IPF;2018-12-15;Czechia;;Frýdlant;Pohár Vision Nutrition dorostenců a juniorů v klasickém silovém trojboji
Aleš Petr;M;SBD;Raw;17.5;18-19;14-18;Sub-Juniors;88.88;93;190;197.5;-205;;197.5;120;127.5;-135;;127.5;240;250;257.5;;257.5;582.5;2;379.05;374.27;358.90;77.92;Yes;;;CSST;IPF;2018-10-20;Czechia;;Sedlčany;Mistrovství České republiky juniorů a dorostu v klasickém silovém trojboji
Aleš Petr;M;SBD;Raw;17.5;18-19;14-18;Sub-Juniors;89.7;93;185;197.5;-202.5;;197.5;115;122.5;127.5;;127.5;230;250;-266.5;;250;575;1;372.42;367.70;352.46;76.57;Yes;;;CSST;IPF;2018-09-15;Czechia;;Krnov;Mistrovství Moravy juniorů a dorostu v klasickém silovém trojboji
Aleš Petr;M;SBD;Raw;17.5;18-19;14-18;Sub-Juniors;89;93;175;190;-205;;190;115;-125;-125;;115;230;250;-267.5;;250;555;2;360.90;356.35;341.69;74.19;Yes;;;CSST;IPF;2018-06-30;Czechia;;Zbýšov;Pohár starosty města Zbýšov dorostu a juniorů v klasickém silovém trojboji s mezinárodní účastí
