Name;Sex;Event;Equipment;Age;AgeClass;BirthYearClass;Division;BodyweightKg;WeightClassKg;Squat1Kg;Squat2Kg;Squat3Kg;Squat4Kg;Best3SquatKg;Bench1Kg;Bench2Kg;Bench3Kg;Bench4Kg;Best3BenchKg;Deadlift1Kg;Deadlift2Kg;Deadlift3Kg;Deadlift4Kg;Best3DeadliftKg;TotalKg;Place;Dots;Wilks;Glossbrenner;Goodlift;Tested;Country;State;Federation;ParentFederation;Date;MeetCountry;MeetState;MeetTown;MeetName
Alessandro Maiorca;M;B;Raw;28.5;24-34;24-39;Senior;117.57;120;;;;;;175;-182.5;-182.5;;175;;;;;;175;7;101.20;101.11;96.85;74.48;Yes;Italy;;FIPL;IPF;2022-06-24;Italy;;S.Zenone al Lambro;8 Gara Nazionale Coppa Bertoletti di Panca Classic
Alessandro Maiorca;M;B;Raw;28.5;24-34;24-39;Senior;114.27;120;;;;;;177.5;182.5;-185;;182.5;;;;;;182.5;3;106.59;106.22;101.66;78.65;Yes;Italy;;FIPL;IPF;2022-01-22;Italy;;S.Zenone al Lambro;6 Gara Nazionale Open di panca classic maschile e femminile
Alessandro Maiorca;M;SBD;Raw;27.5;24-34;24-39;Senior;117.5;120;230;240;245;;245;185;;;;185;250;265;280;;280;710;3;410.67;410.27;392.99;83.30;Yes;Italy;;FIPL;IPF;2021-06-22;Italy;;San Zenone Al Lambro;3 Campionato Italiano di Powerlifting Classic Maschile e Femminile Senior
Alessandro Maiorca;M;SBD;Raw;25.5;24-34;24-39;Open;117.1;120;220;230;235;;235;170;177.5;-185;;177.5;220;;;;220;632.5;8;366.27;365.80;350.36;74.32;Yes;Italy;;FIPL;IPF;2019-10-05;Italy;;San Zenone al Lambro;5° Campionato Open Classic di Powerlifting
Alessandro Maiorca;M;SBD;Raw;25.5;24-34;24-39;Open;117.26;120;210;222.5;232.5;;232.5;165;172.5;177.5;;177.5;240;255;270;;270;680;8;393.59;393.13;376.56;79.85;Yes;Italy;;FIPL;IPF;2019-06-13;Italy;;San Zenone al Lambro;2° Trials Classic Senior di Powerlifting
