Name;Sex;Event;Equipment;Age;AgeClass;BirthYearClass;Division;BodyweightKg;WeightClassKg;Squat1Kg;Squat2Kg;Squat3Kg;Squat4Kg;Best3SquatKg;Bench1Kg;Bench2Kg;Bench3Kg;Bench4Kg;Best3BenchKg;Deadlift1Kg;Deadlift2Kg;Deadlift3Kg;Deadlift4Kg;Best3DeadliftKg;TotalKg;Place;Dots;Wilks;Glossbrenner;Goodlift;Tested;Country;State;Federation;ParentFederation;Date;MeetCountry;MeetState;MeetTown;MeetName
Alex Aguzzoli;M;B;Raw;40.5;40-44;40-49;Master I;98.73;105;;;;;;-110;117.5;-120;;117.5;;;;;;117.5;4;72.73;71.88;68.67;54.16;Yes;;;FIPL;IPF;2018-11-16;Italy;;San Zenone al Lambro;XIX Campionato Italiano di Panca equipped e IV Campionato Italiano di Panca Classic
Alex Aguzzoli;M;B;Raw;39.5;35-39;40-49;Master I;103.14;105;;;;;;120;127.5;-130;;127.5;;;;;;127.5;2;77.46;76.68;73.22;57.57;Yes;;;FIPL;IPF;2017-12-15;Italy;;Cecina;XVIII Campionato Italiano di Panca e III Campionato Classic di Panca
Alex Aguzzoli;M;SBD;Raw;39.5;35-39;40-49;Master I;111.24;120;155;167.5;-172.5;;167.5;110;120;125;;125;195;210;-220;;210;502.5;4;296.37;294.72;281.78;60.42;Yes;;;FIPL;IPF;2017-06-09;Italy;;Taneto di Gattatico;III Campionato Classic di Powerlifting
Alex Aguzzoli;M;D;Raw;39.5;35-39;40-49;Master I;112.37;120;;;;;;;;;;;200;215;-227.5;;215;215;3;126.34;125.73;120.25;;Yes;;;FIPL;IPF;2017-02-24;Italy;;Bolzaneto;XVII Campionato Italiano di Stacco e III Campionato Classic di Stacco
Alex Aguzzoli;M;B;Raw;38.5;35-39;24-39;Open;111.02;120;;;;;;115;-125;-125;;115;;;;;;115;4;67.88;67.49;64.52;50.20;Yes;;;FIPL;IPF;2016-12-16;Italy;;Cecina;XVII Campionato Italiano di Panca e II Campionato Classic di Panca Raw
Alex Aguzzoli;M;SBD;Raw;38.5;35-39;24-39;Open;113.08;120;155;165;170;;170;115;122.5;-125;;122.5;195;210;-232.5;;210;502.5;10;294.60;293.33;280.61;59.97;Yes;;;FIPL;IPF;2016-06-14;Italy;;Taneto di Gattatico;XIII Coppa Bertoletti di Panca e II Campionato Classic di Powerlifting Raw
Alex Aguzzoli;M;D;Raw;38.5;35-39;24-39;Open;111.4;120;;;;;;;;;;;185;200;210;;210;210;3;123.79;123.11;117.71;;Yes;;;FIPL;IPF;2016-02-26;Italy;;Cecina;XVI Campionato Italiano di Stacco e II Campionato Classic di Stacco Raw
Alex Aguzzoli;M;B;Raw;37.5;35-39;24-39;Open;110.86;120;;;;;;-115;-115;115;;115;;;;;;115;3;67.91;67.52;64.55;50.23;Yes;;;FIPL;IPF;2015-12-12;Italy;;Cecina;16° Campionato Italiano di Panca e 1° Campionato Classic di Panca Raw
Alex Aguzzoli;M;SBD;Raw;37.5;35-39;24-39;Open;113.27;120;125;135;-150;;135;-115;115;-122.5;;115;165;175;-200;;175;425;6;249.01;247.97;237.23;50.68;Yes;;;FIPL;IPF;2015-06-19;Italy;;Taneto di Gattatico;12° Coppa Bertoletti di Panca e 5° Trofeo di Powerlifting Raw
